{
  "pack": "strategies-pack-0.1",
  "version": "0.1",
  "generated_from": "strategies/*.md",
  "strategies": [
    {
      "id": "readme",
      "title": "Strategies",
      "description": "Development strategies define the workflow from idea to implementation.",
      "triggers": [
        "readme"
      ],
      "path": "strategies/README.md",
      "body": "# Strategies\n\nDevelopment strategies define the workflow from idea to implementation.\n\n## Available Strategies\n\n| Strategy | Command | Type | Use Case | Phases |\n|----------|---------|------|----------|--------|\n| [interview.md](./interview.md) | `/deft:run:interview` | spec-generating | Standard projects (default) | Sizing gate: Light (Interview → SPECIFICATION) or Full (Interview → PRD → SPECIFICATION) |\n| [yolo.md](./yolo.md) | `/deft:run:yolo` | spec-generating | Quick prototyping | Auto-pilot sizing gate: Light or Full (Johnbot picks) |\n| [speckit.md](./speckit.md) | `/deft:run:speckit` | spec-generating | Large/complex projects | Principles → Specify → Plan → Phase/Epic Scope → Story Readiness → Implement |\n| [map.md](./map.md) | `/deft:run:map` | preparatory | Existing codebases | Map → Chaining Gate |\n| [discuss.md](./discuss.md) | `/deft:run:discuss` | preparatory | Alignment before planning | Feynman technique → locked decisions → Chaining Gate |\n| [probe.md](./probe.md) | `/deft:run:probe` | preparatory | Adversarial plan stress-testing | Walk decision tree → challenge assumptions → surface risks → Chaining Gate |\n| [research.md](./research.md) | `/deft:run:research` | preparatory | Pre-implementation research | Research → Don't Hand-Roll + Common Pitfalls → Chaining Gate |\n| [roadmap.md](./roadmap.md) | `/deft:run:roadmap` | preparatory | Roadmap maintenance | Discover → Triage → Cleanup |\n| [bdd.md](./bdd.md) | `/deft:run:bdd` | preparatory | Acceptance-test-first development | Scenarios → Failing Tests → Lock Decisions → Spec → Chaining Gate |\n| [rapid.md](./rapid.md) | `/deft:run:rapid` | spec-generating | Quick prototypes | Forced-Light path |\n| [enterprise.md](./enterprise.md) | `/deft:run:enterprise` | spec-generating | Compliance-heavy | Forced-Full path |\n\n## Strategy Types\n\nEvery strategy has a **Type** that determines its behavior in the\n[chaining gate](./interview.md#chaining-gate):\n\n- **`preparatory`** — Produces artifacts that inform spec generation (research docs,\n  context files, mapping docs). On completion, returns to the chaining gate so the user\n  can run additional strategies or proceed to spec generation. Can be run multiple times.\n  Some preparatory strategies (currently `map.md`) also support **standalone** invocation\n  via `/deft:run:<name>` — when invoked outside an interview context, they present their\n  own next-step options instead of returning to the chaining gate. See each strategy file\n  for standalone support.\n- **`spec-generating`** — Produces v0.20-conformant output per [v0-20-contract.md](./v0-20-contract.md) (lifecycle folders + PROJECT-DEFINITION.vbrief.json + date-prefixed proposed/ scope vBRIEFs only; SPECIFICATION.md/PROJECT.md as deprecation stubs or omitted). Selecting one at the chaining gate switches the pipeline to that strategy’s spec flow.\n\nCustom strategies MUST declare their type in this table. If the `Type` column is missing,\nthe chaining gate cannot include the strategy.\n\n## v0.20 Output Contract (for spec-generating strategies)\n\nAll spec-generating strategies (interview, yolo, speckit, rapid, enterprise) MUST produce output conforming to [v0-20-contract.md](./v0-20-contract.md):\n\n- Five vbrief/ lifecycle folders (proposed/ pending/ active/ completed/ cancelled/)\n- vbrief/PROJECT-DEFINITION.vbrief.json (full)\n- Scope vBRIEFs ONLY as date-prefixed in vbrief/proposed/YYYY-MM-DD-*.vbrief.json\n- Never dual-write legacy vbrief/specification.vbrief.json\n- SPECIFICATION.md/PROJECT.md only as deprecation-redirect stubs (banner + sentinel) or omitted\n\nThis contract is the single source of truth for s1-contract and the #1166 migrations (s3-s5). Preparatory strategies follow the same dated proposed/ rule when emitting vBRIEFs.\n\n\n## Selecting a Strategy\n\nUse a slash command:\n\n```\n/deft:run:interview my-project\n```\n\nOr specify in `project.md`:\n\n```markdown\n## Strategy\nUse [strategies/interview.md](../strategies/interview.md) for this project.\n```\n\n**Naming rule:** `/deft:run:<x>` always maps to `strategies/<x>.md`. Custom strategies follow the same pattern.\n\n## Creating Custom Strategies\n\nA strategy file defines:\n\n1. **When to use** — project types, team sizes, constraints\n2. **Workflow phases** — ordered steps with transition criteria\n3. **Artifacts** — what documents are produced\n4. **Agent behavior** — how AI should conduct each phase\n\nName your file `strategies/<name>.md` and invoke it with `/deft:run:<name>`.\n"
    },
    {
      "id": "artifact-guards",
      "title": "Artifact Idempotency Guards",
      "description": "Shared guard rules for strategies that write to vBRIEF artifacts. Referenced by individual strategy files to prevent silent overwrites of approved or completed work.",
      "triggers": [
        "artifact-guards"
      ],
      "path": "strategies/artifact-guards.md",